{"acceptance_policy":{"id":"normshift-m1-m2-prereg-v1","local_ref":"acceptance/m1_m2_prereg_v1.json","sha256":"0265082c85b5e381cf30484774a8cba0d7fb11ab4d5dab8dd5aaa6fd6630f773","status":"FROZEN_BEFORE_BLIND_EVALUATION"},"adjudication_status":"EXPERIMENTAL_NOT_ADJUDICATED","corpus_id":"normshift-m1-development-recipes-20260811","corpus_kind":"ACTUAL_STANDARDS_SOURCE_CONTRACT","ground_truth_status":"NOT_INCLUDED","schema_version":"normshift-m1-source-manifest/v1","sources":[{"acquisition_url":"https://www.rfc-editor.org/rfc/rfc2246.html","adapter":"rfc","adapter_version":"1.0.0","byte_length":195469,"canonical_url":"https://www.rfc-editor.org/rfc/rfc2246.html","charset":null,"content_sha256":"82ef7a3d371e5801b445aea0c639b1fa0851ae542d740a5b238d00e07d6c3cf3","curator_retrieved_at_utc":"2026-08-11T00:41:47Z","document_version":"sha256:82ef7a3d371e","etag":"W/\"b589e062b572e18bc21d5ac516864b6a\"","family":"rfc","identity_preflight_version":"1.0.0","last_modified":null,"license":{"document_or_license":"RFC 2026-era document-embedded Full Copyright Statement; IETF Trust TLP publication guidance","redistribution_basis":"The complete RFC says distribution is unlimited and grants copying and distribution when its copyright notice and grant paragraph are retained. The TLP FAQ confirms unmodified IETF Documents may be published for any purpose.","snapshot_distribution":"fetch_recipe_only","url":"https://trustee.ietf.org/documents/trust-legal-provisions/tlp-5/"},"local_ref":"snapshots/rfc/rfc2246.html","media_type":"text/html","normalization_version":"1.0.0","profile":"rfc2119","redirect_chain":["https://www.rfc-editor.org/rfc/rfc2246.html"],"source_id":"rfc-tls-1.0-rfc2246","standard_id":"RFC 2246","version_or_date":"TLS 1.0; January 1999"},{"acquisition_url":"https://www.rfc-editor.org/rfc/rfc4346.html","adapter":"rfc","adapter_version":"1.0.0","byte_length":223410,"canonical_url":"https://www.rfc-editor.org/rfc/rfc4346.html","charset":null,"content_sha256":"b58c88a5bb51205bf656cf80b5053d9eb32db38847daea95b4402b91da7bba1e","curator_retrieved_at_utc":"2026-08-11T00:41:48Z","document_version":"sha256:b58c88a5bb51","etag":"W/\"afc836df464679deaeed76c4955ad74a\"","family":"rfc","identity_preflight_version":"1.0.0","last_modified":null,"license":{"document_or_license":"BCP 78 document notice and IETF Trust Legal Provisions 5.0","redistribution_basis":"The complete RFC says distribution is unlimited, embeds its BCP 78 copyright notice, and the TLP grants publication and distribution of complete unmodified IETF Documents.","snapshot_distribution":"fetch_recipe_only","url":"https://trustee.ietf.org/documents/trust-legal-provisions/tlp-5/"},"local_ref":"snapshots/rfc/rfc4346.html","media_type":"text/html","normalization_version":"1.0.0","profile":"rfc2119","redirect_chain":["https://www.rfc-editor.org/rfc/rfc4346.html"],"source_id":"rfc-tls-1.1-rfc4346","standard_id":"RFC 4346","version_or_date":"TLS 1.1; April 2006"},{"acquisition_url":"https://www.rfc-editor.org/rfc/rfc5246.html","adapter":"rfc","adapter_version":"1.0.0","byte_length":268261,"canonical_url":"https://www.rfc-editor.org/rfc/rfc5246.html","charset":null,"content_sha256":"a6102891f08ad01933fdce6891c0045432b699c917db12903cfa694372b5e86a","curator_retrieved_at_utc":"2026-08-11T00:41:48Z","document_version":"sha256:a6102891f08a","etag":"W/\"cf76bc12a9a2765242c371817484d5b6\"","family":"rfc","identity_preflight_version":"1.0.0","last_modified":null,"license":{"document_or_license":"BCP 78 document notice and IETF Trust Legal Provisions 5.0","redistribution_basis":"The complete RFC says distribution is unlimited, embeds its IETF Trust/BCP 78 copyright notice, and the TLP grants publication and distribution of complete unmodified IETF Documents.","snapshot_distribution":"fetch_recipe_only","url":"https://trustee.ietf.org/documents/trust-legal-provisions/tlp-5/"},"local_ref":"snapshots/rfc/rfc5246.html","media_type":"text/html","normalization_version":"1.0.0","profile":"rfc2119","redirect_chain":["https://www.rfc-editor.org/rfc/rfc5246.html"],"source_id":"rfc-tls-1.2-rfc5246","standard_id":"RFC 5246","version_or_date":"TLS 1.2; August 2008"},{"acquisition_url":"https://www.w3.org/TR/2016/CR-micropub-20161018/","adapter":"w3c","adapter_version":"1.0.0","byte_length":163776,"canonical_url":"https://www.w3.org/TR/2016/CR-micropub-20161018/","charset":"utf-8","content_sha256":"8341ae06105a972b8c5e2e60d9924722a174705b7396619caf734c3b7db890f3","curator_retrieved_at_utc":"2026-08-11T00:41:49Z","document_version":"sha256:8341ae06105a","etag":null,"family":"w3c","identity_preflight_version":"1.0.0","last_modified":"Sat, 15 Oct 2016 17:06:25 GMT","license":{"document_or_license":"W3C Software and Document License, 2015 version","redistribution_basis":"The document links this license. It permits copying and distribution for any purpose, subject to retaining the full license notice, existing notices and disclaimers, and a notice of modifications (none here).","snapshot_distribution":"fetch_recipe_only","url":"https://www.w3.org/copyright/software-license-2015/"},"local_ref":"snapshots/w3c/micropub-cr-20161018.html","media_type":"text/html","normalization_version":"1.0.0","profile":"rfc2119","redirect_chain":["https://www.w3.org/TR/2016/CR-micropub-20161018/"],"source_id":"w3c-micropub-cr-20161018","standard_id":"Micropub","version_or_date":"2016-10-18"},{"acquisition_url":"https://www.w3.org/TR/2017/PR-micropub-20170413/","adapter":"w3c","adapter_version":"1.0.0","byte_length":175848,"canonical_url":"https://www.w3.org/TR/2017/PR-micropub-20170413/","charset":"utf-8","content_sha256":"3edf8e00e5b1068ad83f8a714531d9980acbcee655848f0cc405ba3f8b640597","curator_retrieved_at_utc":"2026-08-11T00:41:49Z","document_version":"sha256:3edf8e00e5b1","etag":null,"family":"w3c","identity_preflight_version":"1.0.0","last_modified":"Thu, 13 Apr 2017 07:59:08 GMT","license":{"document_or_license":"W3C Software and Document License, 2015 version","redistribution_basis":"The document links this license. It permits copying and distribution for any purpose, subject to retaining the full license notice, existing notices and disclaimers, and a notice of modifications (none here).","snapshot_distribution":"fetch_recipe_only","url":"https://www.w3.org/copyright/software-license-2015/"},"local_ref":"snapshots/w3c/micropub-pr-20170413.html","media_type":"text/html","normalization_version":"1.0.0","profile":"rfc2119","redirect_chain":["https://www.w3.org/TR/2017/PR-micropub-20170413/"],"source_id":"w3c-micropub-pr-20170413","standard_id":"Micropub","version_or_date":"2017-04-13"},{"acquisition_url":"https://www.w3.org/TR/2017/REC-micropub-20170523/","adapter":"w3c","adapter_version":"1.0.0","byte_length":172429,"canonical_url":"https://www.w3.org/TR/2017/REC-micropub-20170523/","charset":"utf-8","content_sha256":"9eebd4b244e9b0fce61ab6830a79527ff780ebcd225316009451a9c6d902551d","curator_retrieved_at_utc":"2026-08-11T00:41:49Z","document_version":"sha256:9eebd4b244e9","etag":null,"family":"w3c","identity_preflight_version":"1.0.0","last_modified":"Sun, 21 May 2017 14:54:51 GMT","license":{"document_or_license":"W3C Software and Document License, 2015 version","redistribution_basis":"The document links this license. It permits copying and distribution for any purpose, subject to retaining the full license notice, existing notices and disclaimers, and a notice of modifications (none here).","snapshot_distribution":"fetch_recipe_only","url":"https://www.w3.org/copyright/software-license-2015/"},"local_ref":"snapshots/w3c/micropub-rec-20170523.html","media_type":"text/html","normalization_version":"1.0.0","profile":"rfc2119","redirect_chain":["https://www.w3.org/TR/2017/REC-micropub-20170523/"],"source_id":"w3c-micropub-rec-20170523","standard_id":"Micropub","version_or_date":"2017-05-23"},{"acquisition_url":"https://mimesniff.spec.whatwg.org/review-drafts/2023-07/","adapter":"whatwg","adapter_version":"1.0.0","byte_length":145870,"canonical_url":"https://mimesniff.spec.whatwg.org/review-drafts/2023-07/","charset":"utf-8","content_sha256":"01528914273a059ea6d61035f0b778013b128a3635421da91c3a4199c09cf109","curator_retrieved_at_utc":"2026-08-11T00:41:51Z","document_version":"sha256:01528914273a","etag":"\"64b50be0-239ce\"","family":"whatwg","identity_preflight_version":"1.0.0","last_modified":"Mon, 17 Jul 2023 09:37:36 GMT","license":{"document_or_license":"Creative Commons Attribution 4.0 International (CC BY 4.0)","redistribution_basis":"The Review Draft footer and WHATWG IPR Policy section 7.1.1 license Review Drafts under CC BY 4.0. If a later authorized acquisition is redistributed, full raw HTML would be distributed under CC BY; source-code portions have a separate BSD 3-Clause option.","snapshot_distribution":"fetch_recipe_only","url":"https://creativecommons.org/licenses/by/4.0/"},"local_ref":"snapshots/whatwg/mimesniff-review-2023-07.html","media_type":"text/html","normalization_version":"1.0.0","profile":"whatwg","redirect_chain":["https://mimesniff.spec.whatwg.org/review-drafts/2023-07/"],"source_id":"whatwg-mimesniff-review-2023-07","standard_id":"MIME Sniffing","version_or_date":"2023-07"},{"acquisition_url":"https://mimesniff.spec.whatwg.org/review-drafts/2024-07/","adapter":"whatwg","adapter_version":"1.0.0","byte_length":124153,"canonical_url":"https://mimesniff.spec.whatwg.org/review-drafts/2024-07/","charset":"utf-8","content_sha256":"596ec6c40da0dc935e4664d03d6ac9ea55d3d7787d9eee24bb303cc84717218f","curator_retrieved_at_utc":"2026-08-11T00:41:55Z","document_version":"sha256:596ec6c40da0","etag":"\"66950668-1e4f9\"","family":"whatwg","identity_preflight_version":"1.0.0","last_modified":"Mon, 15 Jul 2024 11:22:16 GMT","license":{"document_or_license":"Creative Commons Attribution 4.0 International (CC BY 4.0)","redistribution_basis":"The Review Draft footer and WHATWG IPR Policy section 7.1.1 license Review Drafts under CC BY 4.0. If a later authorized acquisition is redistributed, full raw HTML wou